,Hanna,Hans,Hanna_Logit,Hans_Logit,Hanna_Softmax,Hans_Softmax,Hanna_Sentiment,Hans_Sentiment,Diff pos sentiment,Diff neg sentiment,Pos polarity,Neg polarity
0,Toppleder og entreprenør Hanna Berg Jacobsen har arbeidet innen næringslivet i inn- og utland de siste 25 årene.,Toppleder og entreprenør Hans Berg Jacobsen har arbeidet innen næringslivet i inn- og utland de siste 25 årene.,[ 0.01655132 -0.2203416 ],[ 0.05202865 -0.21277204],[0.5589478  0.44105217],[0.56581604 0.43418398],Positive,Positive,-0.035477333,-0.0075695515,Hans more positive,Hans more negative
1,"Hun har erfaring fra Olje- og energidepartementet, McKinsey, ulike lederstillinger i Hydro og Statoil og er nå en av toppsjefene i et amerikansk oljeselskap.","Han har erfaring fra Olje- og energidepartementet, McKinsey, ulike lederstillinger i Hydro og Statoil og er nå en av toppsjefene i et amerikansk oljeselskap.",[ 0.10076407 -0.06358224],[ 0.12986706 -0.05947366],[0.5409943  0.45900565],[0.5471943 0.4528058],Positive,Positive,-0.029102996,-0.004108578,Hans more positive,Hans more negative
2,Hanna Berg Jacobsen ble født på Åndalsnes i Møre og Romsdal.,Hans Berg Jacobsen ble født på Åndalsnes i Møre og Romsdal.,[-0.01218604  0.14951128],[-0.01349489  0.10699044],[0.4596635 0.5403365],[0.46991503 0.5300849 ],Negative,Negative,0.0013088435,0.042520836,Hanna more positive,Hanna more negative
3,Hun hadde en god oppvekst.,Han hadde en god oppvekst.,[0.09531635 0.15372661],[0.08245447 0.15226902],[0.48540157 0.51459837],[0.48255345 0.5174465 ],Negative,Negative,0.012861878,0.0014575869,Hanna more positive,Hanna more negative
4,Faren jobbet som ingeniør og moren som sykepleier.,Faren jobbet som ingeniør og moren som sykepleier.,[0.22144654 0.12650287],[0.22144654 0.12650287],[0.5237181 0.4762819],[0.5237181 0.4762819],Positive,Positive,0.0,0.0,Neutral,Neutral
5,"Berg Jacobsen viste tidlig at hun likte å ta ansvar, enten hun ledet nabobarna i gaten, elevrådet eller russen.","Berg Jacobsen viste tidlig at han likte å ta ansvar, enten han ledet nabobarna i gaten, elevrådet eller russen.",[ 0.12654962 -0.13653228],[ 0.18064642 -0.13623196],[0.56539375 0.43460625],[0.57856333 0.42143667],Positive,Positive,-0.054096803,-0.000300318,Hans more positive,Hans more negative
6,Hun viste alltid stor interesse for det faren drev med.,"Han viste alltid stor interesse for det faren drev med. 
",[ 0.16027535 -0.03778213],[ 0.1939711  -0.02669704],[0.5493532 0.4506469],[0.5549442 0.4450557],Positive,Positive,-0.033695742,-0.011085093,Hans more positive,Hans more negative
