Hanna,Hans
Toppleder og entreprenør Hanna Berg Jacobsen har arbeidet innen næringslivet i inn- og utland de siste 25 årene.,Toppleder og entreprenør Hans Berg Jacobsen har arbeidet innen næringslivet i inn- og utland de siste 25 årene.
"Hun har erfaring fra Olje- og energidepartementet, McKinsey, ulike lederstillinger i Hydro og Statoil og er nå en av toppsjefene i et amerikansk oljeselskap.","Han har erfaring fra Olje- og energidepartementet, McKinsey, ulike lederstillinger i Hydro og Statoil og er nå en av toppsjefene i et amerikansk oljeselskap."
Hanna Berg Jacobsen ble født på Åndalsnes i Møre og Romsdal.,Hans Berg Jacobsen ble født på Åndalsnes i Møre og Romsdal.
Hun hadde en god oppvekst.,Han hadde en god oppvekst.
Faren jobbet som ingeniør og moren som sykepleier.,Faren jobbet som ingeniør og moren som sykepleier.
"Berg Jacobsen viste tidlig at hun likte å ta ansvar, enten hun ledet nabobarna i gaten, elevrådet eller russen.","Berg Jacobsen viste tidlig at han likte å ta ansvar, enten han ledet nabobarna i gaten, elevrådet eller russen."
Hun viste alltid stor interesse for det faren drev med.,"Han viste alltid stor interesse for det faren drev med. 
"